{
  "schema_version": "1.0",
  "company_id": "SYNTH-001",
  "company_name": "Synthetic Tools",
  "industry": "industrial technology",
  "is_financial": false,
  "as_of_date": "2025-06-30",
  "currency": "USD",
  "monetary_unit": "millions",
  "share_unit": "millions",
  "market": {
    "date": "2025-06-30",
    "price": 24.0,
    "shares_outstanding": 100.0,
    "dividend_per_share_ttm": 0.48,
    "source_ids": ["market.synthetic"]
  },
  "periods": [
    {
      "period_end": "2019-12-31",
      "visible_at": "2020-03-15",
      "period_type": "annual",
      "months": 12,
      "values": {
        "revenue": 500.0,
        "gross_profit": 200.0,
        "net_income": 40.0,
        "operating_profit": 60.0,
        "pretax_income": 70.0,
        "income_tax": 10.0,
        "depreciation_amortization": 20.0,
        "capital_expenditure": 25.0,
        "research_development": 5.0,
        "total_assets": 800.0,
        "equity": 400.0,
        "total_liabilities": 400.0,
        "current_assets": 300.0,
        "current_liabilities": 150.0,
        "cash": 80.0,
        "short_term_debt": 30.0,
        "long_term_debt": 100.0,
        "accounts_payable": 50.0,
        "notes_payable": 10.0,
        "contract_liabilities": 15.0,
        "other_payables": 10.0,
        "intangible_assets": 20.0,
        "goodwill": 15.0,
        "inventory": 90.0
      },
      "source_ids": ["filing.2019"]
    },
    {
      "period_end": "2020-12-31",
      "visible_at": "2021-03-15",
      "period_type": "annual",
      "months": 12,
      "values": {
        "revenue": 575.0,
        "gross_profit": 235.0,
        "net_income": 48.0,
        "operating_profit": 72.0,
        "pretax_income": 82.0,
        "income_tax": 12.0,
        "depreciation_amortization": 22.0,
        "capital_expenditure": 28.0,
        "research_development": 6.0,
        "total_assets": 860.0,
        "equity": 430.0,
        "total_liabilities": 430.0,
        "current_assets": 325.0,
        "current_liabilities": 165.0,
        "cash": 90.0,
        "short_term_debt": 32.0,
        "long_term_debt": 105.0,
        "accounts_payable": 55.0,
        "notes_payable": 10.0,
        "contract_liabilities": 17.0,
        "other_payables": 11.0,
        "intangible_assets": 21.0,
        "goodwill": 15.0,
        "inventory": 98.0
      },
      "source_ids": ["filing.2020"]
    },
    {
      "period_end": "2021-12-31",
      "visible_at": "2022-03-15",
      "period_type": "annual",
      "months": 12,
      "values": {
        "revenue": 650.0,
        "gross_profit": 270.0,
        "net_income": 56.0,
        "operating_profit": 85.0,
        "pretax_income": 96.0,
        "income_tax": 14.0,
        "depreciation_amortization": 24.0,
        "capital_expenditure": 31.0,
        "research_development": 7.0,
        "total_assets": 930.0,
        "equity": 470.0,
        "total_liabilities": 460.0,
        "current_assets": 350.0,
        "current_liabilities": 180.0,
        "cash": 105.0,
        "short_term_debt": 35.0,
        "long_term_debt": 110.0,
        "accounts_payable": 60.0,
        "notes_payable": 11.0,
        "contract_liabilities": 19.0,
        "other_payables": 12.0,
        "intangible_assets": 22.0,
        "goodwill": 15.0,
        "inventory": 105.0
      },
      "source_ids": ["filing.2021"]
    },
    {
      "period_end": "2022-12-31",
      "visible_at": "2023-03-15",
      "period_type": "annual",
      "months": 12,
      "values": {
        "revenue": 750.0,
        "gross_profit": 320.0,
        "net_income": 68.0,
        "operating_profit": 105.0,
        "pretax_income": 118.0,
        "income_tax": 17.0,
        "depreciation_amortization": 27.0,
        "capital_expenditure": 35.0,
        "research_development": 8.0,
        "total_assets": 1010.0,
        "equity": 520.0,
        "total_liabilities": 490.0,
        "current_assets": 380.0,
        "current_liabilities": 200.0,
        "cash": 120.0,
        "short_term_debt": 38.0,
        "long_term_debt": 115.0,
        "accounts_payable": 65.0,
        "notes_payable": 12.0,
        "contract_liabilities": 21.0,
        "other_payables": 13.0,
        "intangible_assets": 23.0,
        "goodwill": 15.0,
        "inventory": 115.0
      },
      "source_ids": ["filing.2022"]
    },
    {
      "period_end": "2023-12-31",
      "visible_at": "2024-03-15",
      "period_type": "annual",
      "months": 12,
      "values": {
        "revenue": 850.0,
        "gross_profit": 370.0,
        "net_income": 82.0,
        "operating_profit": 130.0,
        "pretax_income": 145.0,
        "income_tax": 21.0,
        "depreciation_amortization": 30.0,
        "capital_expenditure": 40.0,
        "research_development": 9.0,
        "total_assets": 1100.0,
        "equity": 580.0,
        "total_liabilities": 520.0,
        "current_assets": 415.0,
        "current_liabilities": 225.0,
        "cash": 135.0,
        "short_term_debt": 40.0,
        "long_term_debt": 120.0,
        "accounts_payable": 70.0,
        "notes_payable": 13.0,
        "contract_liabilities": 23.0,
        "other_payables": 14.0,
        "intangible_assets": 24.0,
        "goodwill": 15.0,
        "inventory": 125.0
      },
      "source_ids": ["filing.2023"]
    },
    {
      "period_end": "2024-12-31",
      "visible_at": "2025-03-15",
      "period_type": "annual",
      "months": 12,
      "values": {
        "revenue": 1000.0,
        "gross_profit": 450.0,
        "net_income": 100.0,
        "operating_profit": 150.0,
        "pretax_income": 175.0,
        "income_tax": 25.0,
        "depreciation_amortization": 35.0,
        "capital_expenditure": 45.0,
        "research_development": 10.0,
        "total_assets": 1200.0,
        "equity": 650.0,
        "total_liabilities": 550.0,
        "current_assets": 450.0,
        "current_liabilities": 250.0,
        "cash": 150.0,
        "short_term_debt": 45.0,
        "current_portion_long_term_debt": 10.0,
        "long_term_debt": 125.0,
        "bonds_payable": 20.0,
        "accounts_payable": 75.0,
        "notes_payable": 14.0,
        "contract_liabilities": 25.0,
        "advance_receipts": 5.0,
        "other_payables": 15.0,
        "intangible_assets": 25.0,
        "goodwill": 15.0,
        "inventory": 135.0
      },
      "source_ids": ["filing.2024"]
    }
  ],
  "provenance": [
    {
      "source_id": "market.synthetic",
      "source_type": "synthetic_market_snapshot",
      "as_of_date": "2025-06-30",
      "label": "Synthetic market data",
      "uri": ""
    },
    {
      "source_id": "filing.2019",
      "source_type": "synthetic_filing",
      "as_of_date": "2020-03-15",
      "label": "Synthetic 2019 filing",
      "uri": ""
    },
    {
      "source_id": "filing.2020",
      "source_type": "synthetic_filing",
      "as_of_date": "2021-03-15",
      "label": "Synthetic 2020 filing",
      "uri": ""
    },
    {
      "source_id": "filing.2021",
      "source_type": "synthetic_filing",
      "as_of_date": "2022-03-15",
      "label": "Synthetic 2021 filing",
      "uri": ""
    },
    {
      "source_id": "filing.2022",
      "source_type": "synthetic_filing",
      "as_of_date": "2023-03-15",
      "label": "Synthetic 2022 filing",
      "uri": ""
    },
    {
      "source_id": "filing.2023",
      "source_type": "synthetic_filing",
      "as_of_date": "2024-03-15",
      "label": "Synthetic 2023 filing",
      "uri": ""
    },
    {
      "source_id": "filing.2024",
      "source_type": "synthetic_filing",
      "as_of_date": "2025-03-15",
      "label": "Synthetic 2024 filing",
      "uri": ""
    }
  ]
}
